{
  "$schema": "https://json-schema.org/draft/2020-12/schema",
  "$id": "https://example.local/gpu-inference-lab/experiment-report.schema.json",
  "title": "GPU Inference Lab Experiment Report",
  "type": "object",
  "required": [
    "schema_version",
    "experiment",
    "case",
    "serving_profile",
    "run",
    "results"
  ],
  "properties": {
    "schema_version": {
      "const": "experiment-report/v1"
    },
    "experiment": {
      "type": "object",
      "required": ["name", "title"],
      "properties": {
        "name": { "type": "string" },
        "title": { "type": "string" }
      },
      "additionalProperties": false
    },
    "case": {
      "type": "object",
      "required": [
        "id",
        "prompt_token_target",
        "max_tokens",
        "arrival"
      ],
      "properties": {
        "id": { "type": "string" },
        "prompt_token_target": { "type": "integer" },
        "max_tokens": { "type": "integer" },
        "request_shapes": {
          "type": "array",
          "items": {
            "type": "object",
            "required": ["id", "prompt_token_target", "max_tokens", "weight"],
            "properties": {
              "id": { "type": "string" },
              "prompt_token_target": { "type": "integer" },
              "max_tokens": { "type": "integer" },
              "weight": { "type": "integer" }
            },
            "additionalProperties": false
          }
        },
        "client_policy": {
          "type": "object",
          "required": [
            "id",
            "mode",
            "executor",
            "buffer_capacity_requests",
            "max_queue_wait_seconds"
          ],
          "properties": {
            "id": { "type": "string" },
            "mode": { "type": "string" },
            "executor": { "type": "string" },
            "buffer_capacity_requests": { "type": "integer" },
            "max_queue_wait_seconds": { "type": "integer" }
          },
          "additionalProperties": false
        },
        "arrival": {
          "type": "object",
          "required": [
            "start_rate",
            "target_rate",
            "ramp_up_duration",
            "steady_duration",
            "ramp_down_duration",
            "pre_allocated_vus",
            "max_vus",
            "timeout_seconds"
          ],
          "properties": {
            "start_rate": { "type": "number" },
            "target_rate": { "type": "number" },
            "ramp_up_duration": { "type": "string" },
            "steady_duration": { "type": "string" },
            "ramp_down_duration": { "type": "string" },
            "pre_allocated_vus": { "type": "integer" },
            "max_vus": { "type": "integer" },
            "timeout_seconds": { "type": "integer" }
          },
          "additionalProperties": false
        },
        "stream": {
          "type": "object",
          "properties": {
            "samples": { "type": ["integer", "null"] },
            "concurrency": { "type": ["integer", "null"] }
          },
          "additionalProperties": false
        }
      },
      "additionalProperties": false
    },
    "serving_profile": {
      "type": "object",
      "required": [
        "id",
        "model",
        "served_model_name",
        "vllm_image",
        "max_model_len",
        "gpu_memory_utilization"
      ],
      "properties": {
        "id": { "type": "string" },
        "model": { "type": "string" },
        "served_model_name": { "type": "string" },
        "vllm_image": { "type": "string" },
        "dtype": { "type": "string" },
        "kv_cache_dtype": { "type": ["string", "null"] },
        "calculate_kv_scales": { "type": ["boolean", "null"] },
        "tensor_parallel_size": { "type": ["integer", "null"] },
        "node_profile": { "type": ["string", "null"] },
        "max_model_len": { "type": "integer" },
        "gpu_memory_utilization": { "type": "number" },
        "max_num_seqs": { "type": ["integer", "null"] },
        "max_num_batched_tokens": { "type": ["integer", "null"] },
        "quantization": {
          "type": "object",
          "properties": {
            "method": { "type": ["string", "null"] },
            "model_artifact_path": { "type": ["string", "null"] },
            "model_artifact_hash": { "type": ["string", "null"] },
            "recipe_hash": { "type": ["string", "null"] },
            "calibration": {
              "type": "object",
              "properties": {
                "dataset": { "type": ["string", "null"] },
                "split": { "type": ["string", "null"] },
                "samples": { "type": ["integer", "null"] },
                "max_seq_len": { "type": ["integer", "null"] },
                "seed": { "type": ["integer", "null"] }
              },
              "additionalProperties": false
            }
          },
          "additionalProperties": false
        },
        "accuracy_plan": {
          "type": "object",
          "properties": {
            "case_id": { "type": ["string", "null"] },
            "tasks": { "type": ["string", "null"] },
            "num_fewshot": { "type": ["integer", "null"] },
            "limit": { "type": ["integer", "null"] },
            "primary_metric": { "type": ["string", "null"] }
          },
          "additionalProperties": false
        },
        "cost_profile": {
          "type": "object",
          "properties": {
            "id": { "type": ["string", "null"] },
            "cost_scope": { "type": ["string", "null"] },
            "serving_hourly_cost_usd": { "type": ["number", "null"] },
            "cost_source": { "type": ["string", "null"] },
            "region": { "type": ["string", "null"] },
            "instance_type": { "type": ["string", "null"] },
            "instance_hourly_cost_usd": { "type": ["number", "null"] },
            "accelerator_count": { "type": ["integer", "null"] },
            "accelerator_hourly_cost_usd": { "type": ["number", "null"] },
            "linux_hourly_cost_usd": { "type": ["number", "null"] },
            "quantization_build_hourly_cost_usd": { "type": ["number", "null"] },
            "quantization_build_hours": { "type": ["number", "null"] },
            "quantization_build_cost_usd": { "type": ["number", "null"] },
            "slo_p95_request_latency_seconds": { "type": ["number", "null"] },
            "slo_p99_request_latency_seconds": { "type": ["number", "null"] }
          },
          "additionalProperties": false
        }
      },
      "additionalProperties": false
    },
    "run": {
      "type": "object",
      "required": [
        "status",
        "generated_at",
        "source",
        "requires_live_cluster"
      ],
      "properties": {
        "status": { "enum": ["pending", "running", "complete", "partial", "failed"] },
        "generated_at": { "type": "string" },
        "source": { "type": "string" },
        "requires_live_cluster": { "type": "boolean" }
      },
      "additionalProperties": false
    },
    "results": {
      "type": "object",
      "required": ["success", "latency", "serving", "queue", "gpu", "scaling", "slo", "cost"],
      "properties": {
        "success": {
          "type": "object",
          "properties": {
            "completed_requests": { "type": ["integer", "null"] },
            "successful_requests": { "type": ["integer", "null"] },
            "failed_requests": { "type": ["integer", "null"] },
            "oom_events": { "type": ["integer", "null"] }
          },
          "additionalProperties": false
        },
        "latency": {
          "type": "object",
          "properties": {
            "p50_request_latency_seconds": { "type": ["number", "null"] },
            "p95_request_latency_seconds": { "type": ["number", "null"] },
            "p99_request_latency_seconds": { "type": ["number", "null"] }
          },
          "additionalProperties": false
        },
        "client_timing": {
          "type": "object",
          "properties": {
            "p50_client_waiting_seconds": { "type": ["number", "null"] },
            "p95_client_waiting_seconds": { "type": ["number", "null"] },
            "p99_client_waiting_seconds": { "type": ["number", "null"] },
            "p95_client_blocked_seconds": { "type": ["number", "null"] },
            "p95_client_connecting_seconds": { "type": ["number", "null"] },
            "p95_client_tls_handshaking_seconds": { "type": ["number", "null"] },
            "p95_client_sending_seconds": { "type": ["number", "null"] },
            "p95_client_receiving_seconds": { "type": ["number", "null"] }
          },
          "additionalProperties": false
        },
        "serving": {
          "type": "object",
          "properties": {
            "p50_ttft_seconds": { "type": ["number", "null"] },
            "p95_ttft_seconds": { "type": ["number", "null"] },
            "p50_inter_token_latency_seconds": { "type": ["number", "null"] },
            "p95_inter_token_latency_seconds": { "type": ["number", "null"] },
            "requests_per_second": { "type": ["number", "null"] },
            "generated_tokens": { "type": ["integer", "null"] },
            "run_duration_seconds": { "type": ["number", "null"] },
            "generation_tokens_per_second": { "type": ["number", "null"] }
          },
          "additionalProperties": false
        },
        "stream_shapes": {
          "type": "array",
          "items": {
            "type": "object",
            "required": [
              "id",
              "prompt_token_target",
              "max_tokens",
              "weight",
              "completed_requests",
              "failed_requests",
              "p50_request_latency_seconds",
              "p95_request_latency_seconds",
              "p99_request_latency_seconds",
              "p50_ttft_seconds",
              "p95_ttft_seconds",
              "p50_inter_token_latency_seconds",
              "p95_inter_token_latency_seconds",
              "generation_tokens_per_second"
            ],
            "properties": {
              "id": { "type": "string" },
              "prompt_token_target": { "type": "integer" },
              "max_tokens": { "type": "integer" },
              "weight": { "type": "integer" },
              "completed_requests": { "type": "integer" },
              "failed_requests": { "type": "integer" },
              "p50_request_latency_seconds": { "type": ["number", "null"] },
              "p95_request_latency_seconds": { "type": ["number", "null"] },
              "p99_request_latency_seconds": { "type": ["number", "null"] },
              "p50_ttft_seconds": { "type": ["number", "null"] },
              "p95_ttft_seconds": { "type": ["number", "null"] },
              "p50_inter_token_latency_seconds": { "type": ["number", "null"] },
              "p95_inter_token_latency_seconds": { "type": ["number", "null"] },
              "generation_tokens_per_second": { "type": ["number", "null"] }
            },
            "additionalProperties": false
          }
        },
        "queue": {
          "type": "object",
          "properties": {
            "peak_waiting_requests": { "type": ["number", "null"] },
            "peak_running_requests": { "type": ["number", "null"] },
            "peak_active_requests": { "type": ["number", "null"] },
            "offered_iterations": { "type": ["number", "null"] },
            "unserved_iterations": { "type": ["number", "null"] },
            "delivery_ratio": { "type": ["number", "null"] },
            "dropped_iterations": { "type": ["number", "null"] },
            "interrupted_iterations": { "type": ["number", "null"] },
            "buffering_required_requests": { "type": ["number", "null"] },
            "failure_attribution": { "type": ["string", "null"] }
          },
          "additionalProperties": false
        },
        "gpu": {
          "type": "object",
          "properties": {
            "average_gpu_utilization_percent": { "type": ["number", "null"] },
            "max_gpu_utilization_percent": { "type": ["number", "null"] },
            "gpu_memory_used_bytes": { "type": ["number", "null"] },
            "gpu_memory_free_bytes": { "type": ["number", "null"] }
          },
          "additionalProperties": false
        },
        "accuracy": {
          "type": "object",
          "properties": {
            "tasks": { "type": ["string", "null"] },
            "num_fewshot": { "type": ["integer", "null"] },
            "limit": { "type": ["integer", "null"] },
            "primary_metric": { "type": ["string", "null"] },
            "raw_task_scores": {
              "type": "object",
              "properties": {
                "arc_easy": { "type": ["number", "null"] },
                "hellaswag": { "type": ["number", "null"] },
                "winogrande": { "type": ["number", "null"] }
              },
              "additionalProperties": false
            },
            "average_score": { "type": ["number", "null"] },
            "fp4_recovery_vs_bf16_percent": { "type": ["number", "null"] },
            "smoothquant_gain_vs_plain_nvfp4_percent": { "type": ["number", "null"] }
          },
          "additionalProperties": false
        },
        "scaling": {
          "type": "object",
          "properties": {
            "first_nodeclaim_seconds": { "type": ["number", "null"] },
            "first_gpu_node_seconds": { "type": ["number", "null"] },
            "pod_scheduled_seconds": { "type": ["number", "null"] },
            "container_started_seconds": { "type": ["number", "null"] },
            "model_ready_seconds": { "type": ["number", "null"] },
            "first_successful_completion_seconds": { "type": ["number", "null"] }
          },
          "additionalProperties": false
        },
        "slo": {
          "type": "object",
          "properties": {
            "p95_request_latency_target_seconds": { "type": ["number", "null"] },
            "p99_request_latency_target_seconds": { "type": ["number", "null"] },
            "passed": { "type": ["boolean", "null"] }
          },
          "additionalProperties": false
        },
        "cost": {
          "type": "object",
          "properties": {
            "cost_scope": { "type": ["string", "null"] },
            "serving_hourly_cost_usd": { "type": ["number", "null"] },
            "estimated_burst_cost_usd": { "type": ["number", "null"] },
            "estimated_serving_cost_usd": { "type": ["number", "null"] },
            "cost_per_1000_successful_requests_usd": { "type": ["number", "null"] },
            "cost_per_1k_successful_requests_usd": { "type": ["number", "null"] },
            "cost_per_1m_generated_tokens_usd": { "type": ["number", "null"] },
            "cost_per_accuracy_point_usd": { "type": ["number", "null"] },
            "cost_per_accuracy_recovered_percent_usd": { "type": ["number", "null"] },
            "quantization_build_cost_usd": { "type": ["number", "null"] }
          },
          "additionalProperties": false
        }
      },
      "additionalProperties": false
    },
    "notes": {
      "type": "array",
      "items": { "type": "string" }
    }
  },
  "additionalProperties": false
}
