{
  "schema_version": "experiment-report/v1",
  "experiment": {
    "name": "request-patterns",
    "title": "Request Pattern Utilization"
  },
  "case": {
    "id": "burst-small",
    "prompt_token_target": 512,
    "max_tokens": 128,
    "request_shapes": [
      {
        "id": "burst-small",
        "prompt_token_target": 512,
        "max_tokens": 128,
        "weight": 1
      }
    ],
    "client_policy": {
      "id": "direct",
      "mode": "direct",
      "executor": "ramping-arrival-rate",
      "buffer_capacity_requests": 0,
      "max_queue_wait_seconds": 0
    },
    "arrival": {
      "start_rate": 0,
      "target_rate": 18,
      "ramp_up_duration": "20s",
      "steady_duration": "2m",
      "ramp_down_duration": "30s",
      "pre_allocated_vus": 32,
      "max_vus": 128,
      "timeout_seconds": 120
    },
    "stream": {
      "samples": null,
      "concurrency": null
    }
  },
  "serving_profile": {
    "id": "default",
    "model": "Qwen/Qwen2.5-0.5B-Instruct",
    "served_model_name": "qwen2.5-0.5b",
    "vllm_image": "vllm/vllm-openai:v0.9.0",
    "dtype": "float16",
    "kv_cache_dtype": null,
    "calculate_kv_scales": null,
    "tensor_parallel_size": null,
    "node_profile": null,
    "max_model_len": 2048,
    "gpu_memory_utilization": 0.85,
    "max_num_seqs": null,
    "max_num_batched_tokens": null,
    "quantization": {
      "method": null,
      "model_artifact_path": null,
      "model_artifact_hash": null,
      "recipe_hash": null,
      "calibration": {
        "dataset": null,
        "split": null,
        "samples": null,
        "max_seq_len": null,
        "seed": null
      }
    },
    "accuracy_plan": {
      "case_id": null,
      "tasks": null,
      "num_fewshot": null,
      "limit": null,
      "primary_metric": null
    },
    "cost_profile": {
      "id": null,
      "cost_scope": null,
      "serving_hourly_cost_usd": null,
      "cost_source": null,
      "region": null,
      "instance_type": null,
      "instance_hourly_cost_usd": null,
      "accelerator_count": null,
      "accelerator_hourly_cost_usd": null,
      "linux_hourly_cost_usd": null,
      "quantization_build_hourly_cost_usd": null,
      "quantization_build_hours": null,
      "quantization_build_cost_usd": null,
      "slo_p95_request_latency_seconds": null,
      "slo_p99_request_latency_seconds": null
    }
  },
  "run": {
    "status": "complete",
    "generated_at": "2026-05-15T00:03:05Z",
    "source": "scripts/experiment run",
    "requires_live_cluster": true
  },
  "results": {
    "success": {
      "completed_requests": 2283,
      "successful_requests": 2283,
      "failed_requests": 0,
      "oom_events": null
    },
    "latency": {
      "p50_request_latency_seconds": 8.107315611,
      "p95_request_latency_seconds": 8.5623479863,
      "p99_request_latency_seconds": 8.62255887616
    },
    "serving": {
      "p50_ttft_seconds": null,
      "p95_ttft_seconds": null,
      "p50_inter_token_latency_seconds": null,
      "p95_inter_token_latency_seconds": null,
      "requests_per_second": 13.355685953087956,
      "generated_tokens": 292224,
      "run_duration_seconds": 170.938430869,
      "generation_tokens_per_second": 1709.5278019952584
    },
    "stream_shapes": [],
    "queue": {
      "peak_waiting_requests": 1,
      "peak_running_requests": 126,
      "peak_active_requests": 127,
      "offered_iterations": 2610,
      "unserved_iterations": 327,
      "delivery_ratio": 0.874713,
      "dropped_iterations": 327,
      "interrupted_iterations": 0,
      "buffering_required_requests": 327,
      "failure_attribution": "client_queue_limit"
    },
    "gpu": {
      "average_gpu_utilization_percent": 77.33333333333333,
      "max_gpu_utilization_percent": 79,
      "gpu_memory_used_bytes": 14197019989.333334,
      "gpu_memory_free_bytes": 1630186154.6666667
    },
    "accuracy": {
      "tasks": null,
      "num_fewshot": null,
      "limit": null,
      "primary_metric": null,
      "raw_task_scores": {
        "arc_easy": null,
        "hellaswag": null,
        "winogrande": null
      },
      "average_score": null,
      "fp4_recovery_vs_bf16_percent": null,
      "smoothquant_gain_vs_plain_nvfp4_percent": null
    },
    "scaling": {
      "first_nodeclaim_seconds": null,
      "first_gpu_node_seconds": null,
      "pod_scheduled_seconds": null,
      "container_started_seconds": null,
      "model_ready_seconds": null,
      "first_successful_completion_seconds": null
    },
    "slo": {
      "p95_request_latency_target_seconds": null,
      "p99_request_latency_target_seconds": null,
      "passed": null
    },
    "cost": {
      "cost_scope": null,
      "serving_hourly_cost_usd": null,
      "estimated_burst_cost_usd": null,
      "estimated_serving_cost_usd": null,
      "cost_per_1000_successful_requests_usd": null,
      "cost_per_1k_successful_requests_usd": null,
      "cost_per_1m_generated_tokens_usd": null,
      "cost_per_accuracy_point_usd": null,
      "cost_per_accuracy_recovered_percent_usd": null,
      "quantization_build_cost_usd": null
    }
  },
  "notes": [
    "This report records the workload and serving contract for the selected case.",
    "Unavailable fields remain null when the runner did not collect that signal; do not treat missing GPU, queue, scaling, or cost fields as measured evidence."
  ]
}
