{
  "schema_version": "experiment-report/v1",
  "experiment": {
    "name": "kv-cache",
    "title": "KV Cache Vs Concurrency"
  },
  "case": {
    "id": "prompt-8192-output-300-rate-010",
    "prompt_token_target": 8192,
    "max_tokens": 300,
    "request_shapes": [
      {
        "id": "prompt-8192-output-300-rate-010",
        "prompt_token_target": 8192,
        "max_tokens": 300,
        "weight": 1
      }
    ],
    "client_policy": {
      "id": "direct",
      "mode": "direct",
      "executor": "ramping-arrival-rate",
      "buffer_capacity_requests": 0,
      "max_queue_wait_seconds": 0
    },
    "arrival": {
      "start_rate": 0,
      "target_rate": 0.10,
      "ramp_up_duration": "2m",
      "steady_duration": "8m",
      "ramp_down_duration": "2m",
      "pre_allocated_vus": 64,
      "max_vus": 128,
      "timeout_seconds": 300
    }
  },
  "serving_profile": {
    "id": "long-context",
    "model": "Qwen/Qwen2.5-0.5B-Instruct",
    "served_model_name": "qwen2.5-0.5b",
    "vllm_image": "vllm/vllm-openai:v0.9.0",
    "max_model_len": 9216,
    "gpu_memory_utilization": 0.90,
    "max_num_seqs": 32,
    "max_num_batched_tokens": 9216,
    "cost_profile": {
      "id": null,
      "cost_scope": null,
      "serving_hourly_cost_usd": null,
      "slo_p95_request_latency_seconds": null,
      "slo_p99_request_latency_seconds": null
    }
  },
  "run": {
    "status": "complete",
    "generated_at": "2026-05-02T08:15:15Z",
    "source": "scripts/experiment run",
    "requires_live_cluster": true
  },
  "results": {
    "success": {
      "completed_requests": 59,
      "successful_requests": 59,
      "failed_requests": 0,
      "oom_events": null
    },
    "latency": {
      "p50_request_latency_seconds": 4.1651723579999995,
      "p95_request_latency_seconds": 4.3877216327,
      "p99_request_latency_seconds": 4.409769668180001
    },
    "serving": {
      "p50_ttft_seconds": null,
      "p95_ttft_seconds": null,
      "p50_inter_token_latency_seconds": null,
      "p95_inter_token_latency_seconds": null,
      "requests_per_second": 0.08194432397593135,
      "generated_tokens": 17700,
      "run_duration_seconds": 720.001058491,
      "generation_tokens_per_second": 24.583297192779405
    },
    "queue": {
      "peak_waiting_requests": 0,
      "peak_running_requests": 1,
      "peak_active_requests": 1,
      "dropped_iterations": null,
      "interrupted_iterations": 0,
      "buffering_required_requests": null,
      "failure_attribution": "none"
    },
    "gpu": {
      "average_gpu_utilization_percent": null,
      "max_gpu_utilization_percent": null,
      "gpu_memory_used_bytes": null,
      "gpu_memory_free_bytes": null
    },
    "scaling": {
      "first_nodeclaim_seconds": null,
      "first_gpu_node_seconds": null,
      "pod_scheduled_seconds": null,
      "container_started_seconds": null,
      "model_ready_seconds": null,
      "first_successful_completion_seconds": null
    },
    "slo": {
      "p95_request_latency_target_seconds": null,
      "p99_request_latency_target_seconds": null,
      "passed": null
    },
    "cost": {
      "cost_scope": null,
      "serving_hourly_cost_usd": null,
      "estimated_burst_cost_usd": null,
      "cost_per_1000_successful_requests_usd": null,
      "cost_per_1m_generated_tokens_usd": null
    }
  },
  "notes": [
    "This report records the workload and serving contract for the selected case.",
    "Unavailable fields remain null when the runner did not collect that signal; do not treat missing GPU, queue, scaling, or cost fields as measured evidence."
  ]
}
