{
  "schema_version": "experiment-report/v1",
  "experiment": {
    "name": "kv-cache",
    "title": "KV Cache Vs Concurrency"
  },
  "case": {
    "id": "prompt-512-output-100",
    "prompt_token_target": 512,
    "max_tokens": 100,
    "request_shapes": [
      {
        "id": "prompt-512-output-100",
        "prompt_token_target": 512,
        "max_tokens": 100,
        "weight": 1
      }
    ],
    "client_policy": {
      "id": "direct",
      "mode": "direct",
      "executor": "ramping-arrival-rate",
      "buffer_capacity_requests": 0,
      "max_queue_wait_seconds": 0
    },
    "arrival": {
      "start_rate": 1,
      "target_rate": 6,
      "ramp_up_duration": "2m",
      "steady_duration": "8m",
      "ramp_down_duration": "2m",
      "pre_allocated_vus": 96,
      "max_vus": 256,
      "timeout_seconds": 180
    }
  },
  "serving_profile": {
    "id": "default",
    "model": "Qwen/Qwen2.5-0.5B-Instruct",
    "served_model_name": "qwen2.5-0.5b",
    "vllm_image": "vllm/vllm-openai:v0.9.0",
    "max_model_len": 2048,
    "gpu_memory_utilization": 0.85,
    "max_num_seqs": null,
    "max_num_batched_tokens": null,
    "cost_profile": {
      "id": null,
      "cost_scope": null,
      "serving_hourly_cost_usd": null,
      "slo_p95_request_latency_seconds": null,
      "slo_p99_request_latency_seconds": null
    }
  },
  "run": {
    "status": "complete",
    "generated_at": "2026-05-01T23:01:28Z",
    "source": "scripts/experiment run",
    "requires_live_cluster": true
  },
  "results": {
    "success": {
      "completed_requests": 3659,
      "successful_requests": 3659,
      "failed_requests": 0,
      "oom_events": null
    },
    "latency": {
      "p50_request_latency_seconds": 0.9366497269999999,
      "p95_request_latency_seconds": 0.9457788866999999,
      "p99_request_latency_seconds": 0.95043627744
    },
    "serving": {
      "p50_ttft_seconds": null,
      "p95_ttft_seconds": null,
      "p50_inter_token_latency_seconds": null,
      "p95_inter_token_latency_seconds": null,
      "requests_per_second": 5.081937100918285,
      "generated_tokens": 365900,
      "run_duration_seconds": 720.001040418,
      "generation_tokens_per_second": 508.1937100918285
    },
    "queue": {
      "peak_waiting_requests": null,
      "peak_running_requests": null,
      "peak_active_requests": null,
      "dropped_iterations": null,
      "buffering_required_requests": null,
      "failure_attribution": "none"
    },
    "gpu": {
      "average_gpu_utilization_percent": null,
      "max_gpu_utilization_percent": null,
      "gpu_memory_used_bytes": null,
      "gpu_memory_free_bytes": null
    },
    "scaling": {
      "first_nodeclaim_seconds": null,
      "first_gpu_node_seconds": null,
      "pod_scheduled_seconds": null,
      "container_started_seconds": null,
      "model_ready_seconds": null,
      "first_successful_completion_seconds": null
    },
    "slo": {
      "p95_request_latency_target_seconds": null,
      "p99_request_latency_target_seconds": null,
      "passed": null
    },
    "cost": {
      "cost_scope": null,
      "serving_hourly_cost_usd": null,
      "estimated_burst_cost_usd": null,
      "cost_per_1000_successful_requests_usd": null,
      "cost_per_1m_generated_tokens_usd": null
    }
  },
  "notes": [
    "This report records the workload and serving contract for the selected case.",
    "Result fields remain null until a live cluster run collects k6, Prometheus, DCGM, Kubernetes, and cost signals."
  ]
}
