{
  "schema_version": "experiment-report/v1",
  "experiment": {
    "name": "cost",
    "title": "Cost Per Useful Work"
  },
  "case": {
    "id": "steady-cost-efficiency",
    "prompt_token_target": 512,
    "max_tokens": 128,
    "request_shapes": [
      {
        "id": "steady-cost-efficiency",
        "prompt_token_target": 512,
        "max_tokens": 128,
        "weight": 1
      }
    ],
    "client_policy": {
      "id": "direct",
      "mode": "direct",
      "executor": "ramping-arrival-rate",
      "buffer_capacity_requests": 0,
      "max_queue_wait_seconds": 0
    },
    "arrival": {
      "start_rate": 2,
      "target_rate": 8,
      "ramp_up_duration": "30s",
      "steady_duration": "5m",
      "ramp_down_duration": "30s",
      "pre_allocated_vus": 16,
      "max_vus": 64,
      "timeout_seconds": 120
    },
    "stream": {
      "samples": null,
      "concurrency": null
    }
  },
  "serving_profile": {
    "id": "optimized-batched",
    "model": "Qwen/Qwen2.5-0.5B-Instruct",
    "served_model_name": "qwen2.5-0.5b",
    "vllm_image": "vllm/vllm-openai:v0.9.0",
    "dtype": "float16",
    "kv_cache_dtype": null,
    "calculate_kv_scales": null,
    "tensor_parallel_size": null,
    "node_profile": null,
    "max_model_len": 2048,
    "gpu_memory_utilization": 0.85,
    "max_num_seqs": 32,
    "max_num_batched_tokens": 8192,
    "quantization": {
      "method": null,
      "model_artifact_path": null,
      "model_artifact_hash": null,
      "recipe_hash": null,
      "calibration": {
        "dataset": null,
        "split": null,
        "samples": null,
        "max_seq_len": null,
        "seed": null
      }
    },
    "accuracy_plan": {
      "case_id": null,
      "tasks": null,
      "num_fewshot": null,
      "limit": null,
      "primary_metric": null
    },
    "cost_profile": {
      "id": "optimized-batched",
      "cost_scope": "serving-gpu-only",
      "serving_hourly_cost_usd": 0.526,
      "cost_source": null,
      "region": null,
      "instance_type": null,
      "instance_hourly_cost_usd": null,
      "accelerator_count": null,
      "accelerator_hourly_cost_usd": null,
      "linux_hourly_cost_usd": null,
      "quantization_build_hourly_cost_usd": null,
      "quantization_build_hours": null,
      "quantization_build_cost_usd": null,
      "slo_p95_request_latency_seconds": 2.0,
      "slo_p99_request_latency_seconds": 5.0
    }
  },
  "run": {
    "status": "complete",
    "generated_at": "2026-05-15T00:29:16Z",
    "source": "scripts/experiment run",
    "requires_live_cluster": true
  },
  "results": {
    "success": {
      "completed_requests": 2670,
      "successful_requests": 2670,
      "failed_requests": 0,
      "oom_events": null
    },
    "latency": {
      "p50_request_latency_seconds": 1.591771897,
      "p95_request_latency_seconds": 1.61121060655,
      "p99_request_latency_seconds": 1.6182908776899998
    },
    "serving": {
      "p50_ttft_seconds": null,
      "p95_ttft_seconds": null,
      "p50_inter_token_latency_seconds": null,
      "p95_inter_token_latency_seconds": null,
      "requests_per_second": 7.397279236987305,
      "generated_tokens": 341760,
      "run_duration_seconds": 360.943519159,
      "generation_tokens_per_second": 946.851742334375
    },
    "stream_shapes": [],
    "queue": {
      "peak_waiting_requests": 0,
      "peak_running_requests": 12,
      "peak_active_requests": 12,
      "offered_iterations": 2670,
      "unserved_iterations": 0,
      "delivery_ratio": 1.000000,
      "dropped_iterations": 0,
      "interrupted_iterations": 0,
      "buffering_required_requests": 0,
      "failure_attribution": "none"
    },
    "gpu": {
      "average_gpu_utilization_percent": 82.5,
      "max_gpu_utilization_percent": 85,
      "gpu_memory_used_bytes": 13540611413.333334,
      "gpu_memory_free_bytes": 2286594730.6666665
    },
    "accuracy": {
      "tasks": null,
      "num_fewshot": null,
      "limit": null,
      "primary_metric": null,
      "raw_task_scores": {
        "arc_easy": null,
        "hellaswag": null,
        "winogrande": null
      },
      "average_score": null,
      "fp4_recovery_vs_bf16_percent": null,
      "smoothquant_gain_vs_plain_nvfp4_percent": null
    },
    "scaling": {
      "first_nodeclaim_seconds": null,
      "first_gpu_node_seconds": null,
      "pod_scheduled_seconds": null,
      "container_started_seconds": null,
      "model_ready_seconds": null,
      "first_successful_completion_seconds": null
    },
    "slo": {
      "p95_request_latency_target_seconds": 2.0,
      "p99_request_latency_target_seconds": 5.0,
      "passed": true
    },
    "cost": {
      "cost_scope": "serving-gpu-only",
      "serving_hourly_cost_usd": 0.526,
      "estimated_burst_cost_usd": 0.052738,
      "estimated_serving_cost_usd": 0.052738,
      "cost_per_1000_successful_requests_usd": 0.019752,
      "cost_per_1k_successful_requests_usd": 0.019752,
      "cost_per_1m_generated_tokens_usd": 0.154313,
      "cost_per_accuracy_point_usd": null,
      "cost_per_accuracy_recovered_percent_usd": null,
      "quantization_build_cost_usd": null
    }
  },
  "notes": [
    "This report records the workload and serving contract for the selected case.",
    "Unavailable fields remain null when the runner did not collect that signal; do not treat missing GPU, queue, scaling, or cost fields as measured evidence."
  ]
}
