{
  "schema_version": "experiment-report/v1",
  "experiment": {
    "name": "batching",
    "title": "Batching Scheduler Tradeoffs"
  },
  "case": {
    "id": "steady-512-output-128",
    "prompt_token_target": 512,
    "max_tokens": 128,
    "request_shapes": [
      {
        "id": "steady-512-output-128",
        "prompt_token_target": 512,
        "max_tokens": 128,
        "weight": 1
      }
    ],
    "client_policy": {
      "id": "direct",
      "mode": "direct",
      "executor": "ramping-arrival-rate",
      "buffer_capacity_requests": 0,
      "max_queue_wait_seconds": 0
    },
    "arrival": {
      "start_rate": 2,
      "target_rate": 8,
      "ramp_up_duration": "30s",
      "steady_duration": "5m",
      "ramp_down_duration": "30s",
      "pre_allocated_vus": 16,
      "max_vus": 64,
      "timeout_seconds": 120
    }
  },
  "serving_profile": {
    "id": "limited-batching",
    "model": "Qwen/Qwen2.5-0.5B-Instruct",
    "served_model_name": "qwen2.5-0.5b",
    "vllm_image": "vllm/vllm-openai:v0.9.0",
    "max_model_len": 2048,
    "gpu_memory_utilization": 0.85,
    "max_num_seqs": 8,
    "max_num_batched_tokens": 4096,
    "cost_profile": {
      "id": null,
      "cost_scope": null,
      "serving_hourly_cost_usd": null,
      "slo_p95_request_latency_seconds": null,
      "slo_p99_request_latency_seconds": null
    }
  },
  "run": {
    "status": "complete",
    "generated_at": "2026-05-06T06:39:25Z",
    "source": "scripts/experiment run",
    "requires_live_cluster": true
  },
  "results": {
    "success": {
      "completed_requests": 2138,
      "successful_requests": 2138,
      "failed_requests": 0,
      "oom_events": null
    },
    "latency": {
      "p50_request_latency_seconds": 10.341676664000001,
      "p95_request_latency_seconds": 10.55467037475,
      "p99_request_latency_seconds": 10.5969350447
    },
    "serving": {
      "p50_ttft_seconds": null,
      "p95_ttft_seconds": null,
      "p50_inter_token_latency_seconds": null,
      "p95_inter_token_latency_seconds": null,
      "requests_per_second": 5.938875397397177,
      "generated_tokens": 273664,
      "run_duration_seconds": 360.000817821,
      "generation_tokens_per_second": 760.1760508668386
    },
    "queue": {
      "peak_waiting_requests": 56,
      "peak_running_requests": 8,
      "peak_active_requests": 64,
      "offered_iterations": 2669,
      "unserved_iterations": 531,
      "delivery_ratio": 0.801049,
      "dropped_iterations": 531,
      "interrupted_iterations": 0,
      "buffering_required_requests": 531,
      "failure_attribution": "client_queue_limit"
    },
    "gpu": {
      "average_gpu_utilization_percent": 82.16666666666667,
      "max_gpu_utilization_percent": 85,
      "gpu_memory_used_bytes": 13647915690.666666,
      "gpu_memory_free_bytes": 2179290453.3333335
    },
    "scaling": {
      "first_nodeclaim_seconds": null,
      "first_gpu_node_seconds": null,
      "pod_scheduled_seconds": null,
      "container_started_seconds": null,
      "model_ready_seconds": null,
      "first_successful_completion_seconds": null
    },
    "slo": {
      "p95_request_latency_target_seconds": null,
      "p99_request_latency_target_seconds": null,
      "passed": null
    },
    "cost": {
      "cost_scope": null,
      "serving_hourly_cost_usd": null,
      "estimated_burst_cost_usd": null,
      "cost_per_1000_successful_requests_usd": null,
      "cost_per_1m_generated_tokens_usd": null
    }
  },
  "notes": [
    "This report records the workload and serving contract for the selected case.",
    "Unavailable fields remain null when the runner did not collect that signal; do not treat missing GPU, queue, scaling, or cost fields as measured evidence."
  ]
}
